{
  "$schema": "https://json-schema.org/draft/2020-12/schema",
  "$id": "https://karaokedirectory.com/schemas/venue.schema.json",
  "title": "Karaoke Venue Database",
  "description": "Schema for js/data.json \u2014 the full venue listings database. Single source of truth for validate-data.js (CI), submit.html payload shape, the external curator tool, and future Supabase JSONB rows. Cross-reference constraints (e.g. tags must exist in tagDefinitions) are enforced as supplementary checks in scripts/validate-data.js since JSON Schema cannot express them.",
  "type": "object",
  "required": [
    "tagDefinitions",
    "listings"
  ],
  "additionalProperties": false,
  "properties": {
    "tagDefinitions": {
      "description": "Map of tag id \u2192 { label, color, textColor }. Tag ids referenced by venue.tags[].",
      "type": "object",
      "patternProperties": {
        "^[a-z0-9][a-z0-9-]*$": {
          "$ref": "#/$defs/tagDefinition"
        },
        "^[0-9]+\\+$": {
          "$ref": "#/$defs/tagDefinition"
        }
      },
      "additionalProperties": false
    },
    "kjs": {
      "description": "Map of KJ id \u2192 { name, website?, socials? }. Referenced by host.kjId (ADR-007). A duo or named act is a single entry. Optional while the data migrates off inline hosts.",
      "type": "object",
      "patternProperties": {
        "^[a-z0-9][a-z0-9-]*$": {
          "$ref": "#/$defs/registryEntry"
        }
      },
      "additionalProperties": false
    },
    "companies": {
      "description": "Map of company id \u2192 { name, website?, socials? }. Referenced by host.companyId (ADR-007). Optional while the data migrates off inline hosts.",
      "type": "object",
      "patternProperties": {
        "^[a-z0-9][a-z0-9-]*$": {
          "$ref": "#/$defs/registryEntry"
        }
      },
      "additionalProperties": false
    },
    "cities": {
      "description": "Map of city id \u2192 { name }. The legal set of address.city values, closed because the frame is fixed at Austin-metro (#170). Ids are stable so a city can become a link target rather than a string (ADR-011). validate-data.js cross-checks every listing against this map.",
      "type": "object",
      "patternProperties": {
        "^[a-z0-9][a-z0-9-]*$": {
          "type": "object",
          "required": [
            "name"
          ],
          "additionalProperties": false,
          "properties": {
            "name": {
              "type": "string",
              "minLength": 1
            }
          }
        }
      },
      "additionalProperties": false
    },
    "listings": {
      "type": "array",
      "items": {
        "$ref": "#/$defs/venue"
      }
    }
  },
  "$defs": {
    "tagDefinition": {
      "type": "object",
      "required": [
        "label"
      ],
      "additionalProperties": false,
      "properties": {
        "label": {
          "type": "string",
          "minLength": 1
        },
        "color": {
          "type": "string",
          "pattern": "^#[0-9a-fA-F]{3,8}$",
          "description": "Ignored since ADR-014 \u2014 tag colours are authored in css/components.css. Accepted so a not-yet-migrated curator master does not hard-fail CI; validate-data.js warns instead."
        },
        "textColor": {
          "type": "string",
          "pattern": "^#[0-9a-fA-F]{3,8}$",
          "description": "Ignored since ADR-014 \u2014 see color."
        }
      }
    },
    "venue": {
      "type": "object",
      "required": [
        "id",
        "name",
        "address",
        "schedule"
      ],
      "additionalProperties": false,
      "properties": {
        "id": {
          "type": "string",
          "pattern": "^[a-z0-9][a-z0-9-]*$",
          "description": "Lowercase, hyphenated slug, unique across listings."
        },
        "name": {
          "type": "string",
          "minLength": 1
        },
        "active": {
          "type": "boolean",
          "description": "False to hide venue from all pages. Default true when omitted."
        },
        "dedicated": {
          "type": "boolean",
          "description": "True for karaoke-only venues. Auto-adds the 'dedicated' tag at render time."
        },
        "tags": {
          "type": "array",
          "items": {
            "type": "string",
            "minLength": 1
          },
          "uniqueItems": true,
          "description": "Tag ids. Each must exist as a key in tagDefinitions (enforced in validate-data.js)."
        },
        "address": {
          "$ref": "#/$defs/address"
        },
        "coordinates": {
          "$ref": "#/$defs/coordinates"
        },
        "schedule": {
          "type": "array",
          "minItems": 1,
          "items": {
            "$ref": "#/$defs/scheduleEntry"
          }
        },
        "activePeriod": {
          "$ref": "#/$defs/activePeriod"
        },
        "created": {
          "$ref": "#/$defs/created"
        },
        "host": {
          "$ref": "#/$defs/hostAssignment",
          "description": "Default host for shows that don't override it."
        },
        "socials": {
          "oneOf": [
            {
              "type": "null"
            },
            {
              "$ref": "#/$defs/socials"
            }
          ]
        },
        "phone": {
          "type": "string",
          "pattern": "^[-0-9+(). ]{7,}$",
          "description": "Public phone number for the venue, rendered as a tel: link in detail views. The venue's line only \u2014 not a KJ/host or curator-internal number."
        }
      }
    },
    "address": {
      "type": "object",
      "required": [
        "street",
        "city",
        "state",
        "zip"
      ],
      "additionalProperties": false,
      "properties": {
        "street": {
          "type": "string",
          "minLength": 1
        },
        "city": {
          "type": "string",
          "minLength": 1,
          "description": "Must match a name in the top-level `cities` registry; validate-data.js cross-checks it."
        },
        "state": {
          "type": "string",
          "minLength": 2,
          "maxLength": 2
        },
        "zip": {
          "type": "string",
          "pattern": "^\\d{5}(-\\d{4})?$"
        }
      }
    },
    "coordinates": {
      "type": "object",
      "required": [
        "lat",
        "lng"
      ],
      "additionalProperties": false,
      "properties": {
        "lat": {
          "type": "number"
        },
        "lng": {
          "type": "number"
        }
      }
    },
    "activePeriod": {
      "type": "object",
      "required": [
        "start"
      ],
      "additionalProperties": false,
      "description": "Window during which the venue is active. 'end' is optional for open-ended seasonal venues (e.g. 'opened in March, no scheduled end').",
      "properties": {
        "start": {
          "type": "string",
          "format": "date"
        },
        "end": {
          "type": "string",
          "format": "date"
        }
      }
    },
    "created": {
      "type": "string",
      "format": "date",
      "description": "The day this venue or show was added to the directory (#322, ADR-017). Drives the New section with activePeriod.start: a record is New for 30 days from the later of the two. Stamped by the curator on add; a Split carries it forward unless the owner marks the new half as a new show. Reconstructed once from git for records added in the 30 days before the field existed; older records stay undated, and undated means not new."
    },
    "featured": {
      "description": "A featured placement on this show (#322, ADR-017): the nights it sits in the day card's Featured section. A window, inclusive, either bound open, the same shape as a show's activePeriod; or true while placements are tests. Not allowed on one-time events, which are already pinned. validate-data.js checks start <= end and warns once the window has ended.",
      "oneOf": [
        {
          "const": true
        },
        {
          "type": "object",
          "additionalProperties": false,
          "minProperties": 1,
          "properties": {
            "start": {
              "type": "string",
              "format": "date"
            },
            "end": {
              "type": "string",
              "format": "date"
            }
          }
        }
      ]
    },
    "entryActivePeriod": {
      "type": "object",
      "additionalProperties": false,
      "minProperties": 1,
      "description": "A show's lifespan (ADR-016): the known first and last night of this schedule entry, each written only when the real-world date is known and never backfilled. Either bound may appear alone; a missing bound is open. A change (a show moving nights, changing host or time on a date) ends the old entry and opens a new one; a correction edits in place with no dates. validate-data.js checks start <= end and warns once 'end' is more than 30 days past.",
      "properties": {
        "start": {
          "type": "string",
          "format": "date"
        },
        "end": {
          "type": "string",
          "format": "date"
        }
      }
    },
    "scheduleEntry": {
      "type": "object",
      "required": [
        "frequency",
        "startTime"
      ],
      "additionalProperties": false,
      "properties": {
        "frequency": {
          "type": "string",
          "enum": [
            "every",
            "first",
            "second",
            "third",
            "fourth",
            "fifth",
            "last",
            "once"
          ]
        },
        "day": {
          "type": "string",
          "enum": [
            "Sunday",
            "Monday",
            "Tuesday",
            "Wednesday",
            "Thursday",
            "Friday",
            "Saturday"
          ]
        },
        "date": {
          "type": "string",
          "format": "date",
          "description": "Required when frequency is 'once'."
        },
        "startTime": {
          "$ref": "#/$defs/timeOfDay"
        },
        "endTime": {
          "oneOf": [
            {
              "type": "null"
            },
            {
              "$ref": "#/$defs/timeOfDay"
            }
          ],
          "description": "Null when the venue only advertises a start time."
        },
        "eventName": {
          "type": "string",
          "minLength": 1
        },
        "eventUrl": {
          "type": "string",
          "format": "uri"
        },
        "host": {
          "$ref": "#/$defs/hostAssignment",
          "description": "Host for this show only. Fully replaces the venue-level host \u2014 fields are not merged."
        },
        "activePeriod": {
          "$ref": "#/$defs/entryActivePeriod"
        },
        "exclusions": {
          "type": "array",
          "description": "One-off dates on which the recurring event does not happen (e.g. private events, holidays, a temporary closing). Interruptions inside a show's life; its start and end belong in activePeriod (ADR-016).",
          "items": {
            "type": "object",
            "required": [
              "date"
            ],
            "additionalProperties": false,
            "properties": {
              "date": {
                "type": "string",
                "format": "date"
              },
              "reason": {
                "type": "string",
                "minLength": 1
              }
            }
          }
        },
        "socials": {
          "oneOf": [
            {
              "type": "null"
            },
            {
              "$ref": "#/$defs/socials"
            }
          ]
        },
        "lastVerified": {
          "type": "string",
          "format": "date",
          "description": "The show date the latest evidence confirms (ADR-015, #275) — a night this show ran or will run, not the day the evidence was seen. May be in the future: a flier for Oct 1 confirms Oct 1, and that night's calendar card carries the Announced marker. Absent means unrecorded, not wrong. Derived by the curator from its private announcement records; never backfilled."
        },
        "created": {
          "$ref": "#/$defs/created"
        },
        "featured": {
          "$ref": "#/$defs/featured"
        }
      },
      "allOf": [
        {
          "if": {
            "properties": {
              "frequency": {
                "const": "once"
              }
            },
            "required": [
              "frequency"
            ]
          },
          "then": {
            "required": [
              "date"
            ],
            "properties": {
              "activePeriod": false,
              "featured": false
            }
          },
          "else": {
            "required": [
              "day"
            ]
          }
        }
      ]
    },
    "timeOfDay": {
      "type": "string",
      "pattern": "^([01]\\d|2[0-3]):[0-5]\\d$",
      "description": "HH:MM in 24-hour format."
    },
    "hostAssignment": {
      "description": "Who runs a show. Either a registry ref pair (preferred, ADR-007) or the legacy inline object still accepted during the migration window. The two shapes are mutually exclusive \u2014 each forbids the other's properties \u2014 so oneOf is unambiguous.",
      "oneOf": [
        {
          "type": "null"
        },
        {
          "$ref": "#/$defs/hostRef"
        },
        {
          "$ref": "#/$defs/host"
        }
      ]
    },
    "hostRef": {
      "type": "object",
      "additionalProperties": false,
      "description": "Reference into the kjs/companies registries. At least one id required: companyId alone (a company runs the night, KJ unrecorded or rotating), kjId alone (independent), or both. The KJ\u2194company association lives here, on the show \u2014 never on the registry entries \u2014 so rosters stay derived and cannot go stale (ADR-007).",
      "properties": {
        "kjId": {
          "type": "string",
          "pattern": "^[a-z0-9][a-z0-9-]*$"
        },
        "companyId": {
          "type": "string",
          "pattern": "^[a-z0-9][a-z0-9-]*$"
        }
      },
      "anyOf": [
        {
          "required": [
            "kjId"
          ]
        },
        {
          "required": [
            "companyId"
          ]
        }
      ]
    },
    "registryEntry": {
      "type": "object",
      "required": [
        "name"
      ],
      "additionalProperties": false,
      "description": "One KJ or one company. Shared shape for both registries.",
      "properties": {
        "name": {
          "type": "string",
          "minLength": 1
        },
        "website": {
          "type": "string",
          "format": "uri"
        },
        "socials": {
          "oneOf": [
            {
              "type": "null"
            },
            {
              "$ref": "#/$defs/socials"
            }
          ]
        }
      }
    },
    "host": {
      "type": "object",
      "additionalProperties": false,
      "description": "Legacy inline host, accepted during the migration window and emitted by submit.html for curator reconciliation. Superseded by hostRef.",
      "properties": {
        "name": {
          "type": "string",
          "minLength": 1
        },
        "affiliation": {
          "type": "string",
          "minLength": 1
        },
        "website": {
          "type": "string",
          "format": "uri"
        },
        "socials": {
          "oneOf": [
            {
              "type": "null"
            },
            {
              "$ref": "#/$defs/socials"
            }
          ]
        }
      },
      "anyOf": [
        {
          "required": [
            "name"
          ]
        },
        {
          "required": [
            "affiliation"
          ]
        }
      ]
    },
    "socials": {
      "type": "object",
      "additionalProperties": false,
      "minProperties": 1,
      "properties": {
        "website": {
          "type": "string",
          "format": "uri"
        },
        "facebook": {
          "type": "string",
          "format": "uri"
        },
        "instagram": {
          "type": "string",
          "format": "uri"
        },
        "twitter": {
          "type": "string",
          "format": "uri"
        },
        "tiktok": {
          "type": "string",
          "format": "uri"
        },
        "youtube": {
          "type": "string",
          "format": "uri"
        },
        "bluesky": {
          "type": "string",
          "format": "uri"
        }
      }
    }
  }
}
