{
  "tagDefinitions": {
    "dedicated": {
      "label": "Dedicated"
    },
    "lgbtq": {
      "label": "LGBTQ+"
    },
    "dive": {
      "label": "Dive Bar"
    },
    "sports-bar": {
      "label": "Sports Bar"
    },
    "country-bar": {
      "label": "Country Bar"
    },
    "21+": {
      "label": "21+"
    },
    "18+": {
      "label": "18+"
    },
    "all-ages": {
      "label": "All Ages"
    },
    "family-friendly": {
      "label": "Family"
    },
    "smoking-inside": {
      "label": "Smoking Inside"
    },
    "restaurant": {
      "label": "Restaurant"
    },
    "outdoor": {
      "label": "Outdoor"
    },
    "live-band-karaoke": {
      "label": "Live Band"
    },
    "billiards": {
      "label": "Billiards"
    },
    "brewery": {
      "label": "Brewery"
    },
    "games": {
      "label": "Games"
    },
    "craft-cocktails": {
      "label": "Craft Cocktails"
    },
    "neighborhood": {
      "label": "Neighborhood Bar"
    },
    "special-event": {
      "label": "Special Event"
    }
  },
  "cities": {
    "austin": {
      "name": "Austin"
    },
    "buda": {
      "name": "Buda"
    },
    "cedar-park": {
      "name": "Cedar Park"
    },
    "del-valle": {
      "name": "Del Valle"
    },
    "dripping-springs": {
      "name": "Dripping Springs"
    },
    "elgin": {
      "name": "Elgin"
    },
    "georgetown": {
      "name": "Georgetown"
    },
    "hutto": {
      "name": "Hutto"
    },
    "jonestown": {
      "name": "Jonestown"
    },
    "kyle": {
      "name": "Kyle"
    },
    "lakeway": {
      "name": "Lakeway"
    },
    "leander": {
      "name": "Leander"
    },
    "manchaca": {
      "name": "Manchaca"
    },
    "manor": {
      "name": "Manor"
    },
    "pflugerville": {
      "name": "Pflugerville"
    },
    "round-rock": {
      "name": "Round Rock"
    },
    "taylor": {
      "name": "Taylor"
    }
  },
  "kjs": {
    "andy-hartsock": {
      "name": "Andy Hartsock"
    },
    "armando": {
      "name": "Armando"
    },
    "average-joe": {
      "name": "Average Joe"
    },
    "baby-jesus": {
      "name": "Baby Jesus"
    },
    "bee-purrs": {
      "name": "Bee Purrs"
    },
    "dan-desetto": {
      "name": "Dan DeSetto"
    },
    "dj-cysum-and-mo": {
      "name": "DJ Cysum & Mo"
    },
    "dj-pnasty": {
      "name": "DJ P'Nasty"
    },
    "erin-hierholzer": {
      "name": "Erin Hierholzer"
    },
    "ill-will": {
      "name": "Ill Will"
    },
    "jason-lynum": {
      "name": "Jason Lynum"
    },
    "jen": {
      "name": "Jen"
    },
    "john-roberts": {
      "name": "John Roberts"
    },
    "keith-ruckus": {
      "name": "Keith Ruckus"
    },
    "kevin": {
      "name": "Kevin"
    },
    "kim": {
      "name": "Kim"
    },
    "kj-armando-and-paola": {
      "name": "KJ Armando and Paola"
    },
    "kj-j3n": {
      "name": "KJ J3N"
    },
    "kj-stephanie": {
      "name": "KJ Stephanie"
    },
    "laura-torrez-studio": {
      "name": "Laura Torrez Studio"
    },
    "murrah": {
      "name": "Murrah"
    },
    "shelly-dowdy": {
      "name": "Shelly Dowdy"
    },
    "tj": {
      "name": "TJ"
    },
    "xpider-cantu": {
      "name": "Xpider Cantu",
      "website": "https://www.xpidermagic.com/karaoke"
    },
    "isaac-moreno": {
      "name": "Isaac Moreno"
    },
    "deb-o-rah": {
      "name": "DEB-O-RAH"
    },
    "gi-james": {
      "name": "GI James"
    },
    "selma-bawdy": {
      "name": "Selma Bawdy"
    }
  },
  "companies": {
    "all-about-music": {
      "name": "All About Music"
    },
    "by-request-karaoke": {
      "name": "By Request Karaoke",
      "website": "https://www.facebook.com/brkaraoke"
    },
    "cpr-mobile-djs": {
      "name": "CPR Mobile DJs"
    },
    "diamond-karaoke-austin": {
      "name": "Diamond Karaoke Austin"
    },
    "karaoke-under-the-moon": {
      "name": "Karaoke Under the Moon"
    },
    "karaoke-underground": {
      "name": "Karaoke Underground",
      "website": "https://karaokeunderground.com/"
    },
    "lions-den-tea": {
      "name": "Lion's Den Tea"
    },
    "live-music-in-austin": {
      "name": "Live Music In Austin"
    },
    "marshall-joshua-entertainment": {
      "name": "Marshall Joshua Entertainment"
    },
    "party-pipes-karaoke": {
      "name": "Party Pipes Karaoke"
    },
    "planet-karaoke": {
      "name": "Planet Karaoke"
    },
    "poppin-off-with-poppy-karaoke": {
      "name": "Poppin' Off with Poppy Karaoke"
    },
    "ruckus-atx": {
      "name": "Ruckus ATX"
    },
    "smart-ass-entertainment": {
      "name": "Smart Ass Entertainment"
    },
    "starling-karaoke": {
      "name": "Starling Karaoke"
    },
    "story-oke-austin": {
      "name": "Story-Oke Austin",
      "website": "https://www.storyokeaustin.com/"
    },
    "stryke3-karaoke": {
      "name": "Stryke3 Karaoke",
      "website": "https://www.austinkaraokeshows.com/"
    },
    "texas-live-band-karaoke": {
      "name": "Texas Live Band Karaoke",
      "website": "https://www.facebook.com/texaslbk"
    }
  },
  "listings": [
    {
      "id": "sociedad",
      "name": "Sociedad",
      "tags": [
        "restaurant"
      ],
      "dedicated": false,
      "address": {
        "street": "119 E Main Street",
        "city": "Round Rock",
        "state": "TX",
        "zip": "78664"
      },
      "schedule": [
        {
          "frequency": "every",
          "day": "Tuesday",
          "startTime": "19:30",
          "endTime": "00:00"
        },
        {
          "frequency": "every",
          "day": "Wednesday",
          "startTime": "19:30",
          "endTime": "00:00"
        }
      ],
      "host": {
        "companyId": "diamond-karaoke-austin"
      },
      "socials": {
        "facebook": "https://www.facebook.com/AlcoveCantina",
        "instagram": "https://www.instagram.com/alcovecantinarr/",
        "twitter": "https://twitter.com/AlcoveCantina",
        "website": "https://www.alcovecantina.com/"
      },
      "coordinates": {
        "lat": 30.5086031,
        "lng": -97.6779341
      }
    },
    {
      "id": "the-austin-eagle",
      "name": "The Austin Eagle",
      "tags": [
        "lgbtq"
      ],
      "dedicated": false,
      "address": {
        "street": "8201 Cross Park",
        "city": "Austin",
        "state": "TX",
        "zip": "78754"
      },
      "schedule": [
        {
          "frequency": "every",
          "day": "Sunday",
          "startTime": "20:00",
          "endTime": "00:00"
        },
        {
          "frequency": "every",
          "day": "Wednesday",
          "startTime": "20:00",
          "endTime": "00:00"
        }
      ],
      "host": null,
      "socials": {
        "facebook": "https://www.facebook.com/profile.php?id=100088287849207",
        "instagram": "https://www.instagram.com/theaustineagle/",
        "website": "https://theaustineagle.com/"
      },
      "coordinates": {
        "lat": 30.3310359,
        "lng": -97.6668989
      }
    },
    {
      "id": "bar-louie",
      "name": "Bar Louie",
      "tags": [
        "sports-bar"
      ],
      "dedicated": false,
      "address": {
        "street": "270 Bass Pro Dr",
        "city": "Round Rock",
        "state": "TX",
        "zip": "78665"
      },
      "schedule": [
        {
          "frequency": "every",
          "day": "Wednesday",
          "startTime": "19:00",
          "endTime": "22:00"
        }
      ],
      "host": null,
      "socials": {
        "website": "https://www.barlouie.com/locations/us/tx/round-rock/round-rock"
      },
      "coordinates": {
        "lat": 30.5699913,
        "lng": -97.6873605
      }
    },
    {
      "id": "big-easy-saloon",
      "name": "Big Easy Saloon",
      "tags": [
        "neighborhood"
      ],
      "dedicated": false,
      "address": {
        "street": "15601 Vision Dr.",
        "city": "Pflugerville",
        "state": "TX",
        "zip": "78660"
      },
      "schedule": [
        {
          "frequency": "every",
          "day": "Sunday",
          "startTime": "20:30",
          "endTime": "00:30"
        }
      ],
      "host": {
        "kjId": "dj-cysum-and-mo"
      },
      "socials": {
        "facebook": "https://www.facebook.com/bigeasysaloonpflugerville/",
        "instagram": "https://www.instagram.com/bigeasysaloonpflugerville/",
        "website": "https://www.bigeasysaloonpflugerville.com/"
      },
      "coordinates": {
        "lat": 30.4492672,
        "lng": -97.6613393
      }
    },
    {
      "id": "big-shotz-neighborhood-bar",
      "name": "Big Shotz Neighborhood Bar",
      "tags": [
        "neighborhood"
      ],
      "dedicated": false,
      "address": {
        "street": "399 W Louis Henna Blvd",
        "city": "Austin",
        "state": "TX",
        "zip": "78728"
      },
      "schedule": [
        {
          "frequency": "every",
          "day": "Friday",
          "startTime": "21:30",
          "endTime": "01:30",
          "lastVerified": "2026-10-16"
        }
      ],
      "host": {
        "kjId": "erin-hierholzer"
      },
      "coordinates": {
        "lat": 30.4790993,
        "lng": -97.6780171
      }
    },
    {
      "id": "black-sparrow-music-parlor",
      "name": "Black Sparrow Music Parlor",
      "active": true,
      "dedicated": false,
      "address": {
        "street": "113 W 2nd St",
        "city": "Taylor",
        "state": "TX",
        "zip": "76574"
      },
      "schedule": [
        {
          "frequency": "once",
          "date": "2026-02-05",
          "startTime": "21:00",
          "endTime": "00:00",
          "eventName": "Nineties Indie Karaoke w Karaoke Underground!",
          "eventUrl": "https://www.facebook.com/share/1GGYVEVcUv/"
        }
      ],
      "host": {
        "companyId": "karaoke-underground"
      },
      "socials": {
        "website": "https://www.blacksparrowmusicparlor.com/",